{
  "$schema": "./source-plan.schema.json",
  "schemaVersion": 1,
  "planId": "RRSIF-SOURCE-PLAN-2026-09-15",
  "observedAt": "2026-09-15T13:16:10Z",
  "allowedOrigins": [
    "https://eur-lex.europa.eu",
    "https://sede.agenciatributaria.gob.es",
    "https://www.boe.es",
    "https://www.w3.org",
    "https://www2.agenciatributaria.gob.es"
  ],
  "sources": [
    {
      "id": "BOE-LGT-CONSOLIDATED",
      "sourceId": "SRC-0010",
      "title": "General Tax Law current consolidated XML",
      "authority": "BOE",
      "role": "binding",
      "url": "https://www.boe.es/datosabiertos/api/legislacion-consolidada/id/BOE-A-2003-23186",
      "path": "legal/lgt-consolidated.xml",
      "kind": "xml",
      "accept": "application/xml",
      "maximumBytes": 2000000,
      "bytes": 1729789,
      "sha256": "47ebc737b2bdd962755c5fa85367278ffd15746443a581dd4a9627f39acd5027",
      "sha512": "c623244b768055b225db4d1865db4045e2a890c06310deb5d5e5cede9792dfe9f91abac3942857e8343155abdee4deb56e4285aead2fddbc84313c771c364910",
      "lastModified": null,
      "licenseId": "BOE-REUSE-TERMS",
      "redistribution": "official-legal-text",
      "dependencies": ["BOE-LAW-11-2021"],
      "requiredFor": ["REG-0003", "REG-0007"]
    },
    {
      "id": "BOE-LAW-11-2021",
      "sourceId": "SRC-0084",
      "title": "Law 11/2021 original official publication",
      "authority": "BOE",
      "role": "binding",
      "url": "https://www.boe.es/eli/es/l/2021/07/09/11/dof/spa/pdf",
      "path": "legal/law-11-2021.pdf",
      "kind": "pdf",
      "accept": "application/pdf",
      "maximumBytes": 1000000,
      "bytes": 783153,
      "sha256": "0921c1ae747b86221d9d89fc3805a48eeed94717da8eadc50aa10d7cfa195a1a",
      "sha512": "e9163ce5516562a9ff0b564177535b97062c4b7b8c2fa4068606faa0b3315cc01a81ac11fd23950063f8813666b8017e717d9e17a8bb4b147d616643f0443a72",
      "lastModified": null,
      "licenseId": "BOE-REUSE-TERMS",
      "redistribution": "official-legal-text",
      "dependencies": [],
      "requiredFor": ["REG-0003", "REG-0007"]
    },
    {
      "id": "BOE-RD-1007-2023",
      "sourceId": "SRC-0011",
      "title": "Royal Decree 1007/2023 original official publication",
      "authority": "BOE",
      "role": "binding",
      "url": "https://www.boe.es/eli/es/rd/2023/12/05/1007/dof/spa/pdf",
      "path": "legal/rd-1007-2023.pdf",
      "kind": "pdf",
      "accept": "application/pdf",
      "maximumBytes": 500000,
      "bytes": 303380,
      "sha256": "b5f695507aa10d461117d7a86b824f92ca50bcab7556add59ab7027a758b9146",
      "sha512": "e5a8fde97c0b3b405a638aedd748c6e279a63460ee369af36d58c1a390e022ba08688352dee7443885e217af0e8a977a886a0f436dc2aeda0c54d6c144e56235",
      "lastModified": null,
      "licenseId": "BOE-REUSE-TERMS",
      "redistribution": "official-legal-text",
      "dependencies": ["BOE-LAW-11-2021"],
      "requiredFor": ["REG-0001", "REG-0003", "REG-0005", "REG-0006", "REG-0007"]
    },
    {
      "id": "BOE-RD-1007-2023-CONSOLIDATED",
      "sourceId": "SRC-0011",
      "title": "Royal Decree 1007/2023 current consolidated XML",
      "authority": "BOE",
      "role": "binding",
      "url": "https://www.boe.es/datosabiertos/api/legislacion-consolidada/id/BOE-A-2023-24840",
      "path": "legal/rd-1007-2023-consolidated.xml",
      "kind": "xml",
      "accept": "application/xml",
      "maximumBytes": 250000,
      "bytes": 110088,
      "sha256": "b2222a0c5a88c57eaa0f42d7b35b560caf09e50d85d6eb6cfd5234422993bbfa",
      "sha512": "500cdfdff05c068393fb18826ea0c877c3893f5586a5adf37659eb872a5bc37fabdb5428c36f608ac859d03440bf3e16233b38b74b38ccf311107777ef5dbda0",
      "lastModified": null,
      "licenseId": "BOE-REUSE-TERMS",
      "redistribution": "official-legal-text",
      "dependencies": ["BOE-RD-1007-2023", "BOE-RD-254-2025", "BOE-RDL-15-2025"],
      "requiredFor": ["REG-0001", "REG-0003", "REG-0004", "REG-0005", "REG-0006", "REG-0007"]
    },
    {
      "id": "BOE-RD-254-2025",
      "sourceId": "SRC-0012",
      "title": "Royal Decree 254/2025 original official publication",
      "authority": "BOE",
      "role": "binding",
      "url": "https://www.boe.es/eli/es/rd/2025/04/01/254/dof/spa/pdf",
      "path": "legal/rd-254-2025.pdf",
      "kind": "pdf",
      "accept": "application/pdf",
      "maximumBytes": 500000,
      "bytes": 223584,
      "sha256": "3d52cc7f5a1cfd0a0772ce6a69410f78f30e526b079e767d5b909cb6d19a70ed",
      "sha512": "dc552192e771b6a13cf5191847b0720803238ed02ea9c2566ae04b255b60562cd473bbec422afa938feadbeaf87b6f6bca4c7631b450a9a57eefbc0b81e63c2d",
      "lastModified": null,
      "licenseId": "BOE-REUSE-TERMS",
      "redistribution": "official-legal-text",
      "dependencies": ["BOE-RD-1007-2023"],
      "requiredFor": ["REG-0003", "REG-0004"]
    },
    {
      "id": "BOE-RDL-15-2025",
      "sourceId": "SRC-0013",
      "title": "Royal Decree-law 15/2025 original official publication",
      "authority": "BOE",
      "role": "binding",
      "url": "https://www.boe.es/eli/es/rdl/2025/12/02/15/dof/spa/pdf",
      "path": "legal/rdl-15-2025.pdf",
      "kind": "pdf",
      "accept": "application/pdf",
      "maximumBytes": 500000,
      "bytes": 230661,
      "sha256": "08a425a70b75bce60895a1820aea6a0c1a32e51ba5eb24bd87b25b44b52db598",
      "sha512": "d1859b5ebaad633a5a28cef36a09b53854e4ee64ce146728395aaaca376565b349e7cb55f5551fff4e20c25089a86471848f7b3ae665b707d54cea054a0cf91b",
      "lastModified": null,
      "licenseId": "BOE-REUSE-TERMS",
      "redistribution": "official-legal-text",
      "dependencies": ["BOE-RD-1007-2023"],
      "requiredFor": ["REG-0003", "REG-0004"]
    },
    {
      "id": "BOE-ORDER-HAC-1177-2024",
      "sourceId": "SRC-0014",
      "title": "Order HAC/1177/2024 original official publication",
      "authority": "BOE",
      "role": "binding",
      "url": "https://www.boe.es/eli/es/o/2024/10/17/hac1177/dof/spa/pdf",
      "path": "legal/order-hac-1177-2024.pdf",
      "kind": "pdf",
      "accept": "application/pdf",
      "maximumBytes": 1000000,
      "bytes": 858441,
      "sha256": "94344cbc2841fc5c7e759b9a674c821520dc10a12b172f26a415ce8bffa882a2",
      "sha512": "3594f2258881c6a05bfc502fd5cab0ddbbe706c15b7419dc1cba28adee795ce46927530077e778886e2c0439d812688cea9a096dbb908c37769d7c6dd1b1ac13",
      "lastModified": null,
      "licenseId": "BOE-REUSE-TERMS",
      "redistribution": "official-legal-text",
      "dependencies": ["BOE-RD-1007-2023"],
      "requiredFor": ["REG-0003", "REG-0005", "REG-0006", "REG-0007", "REG-0011"]
    },
    {
      "id": "BOE-ORDER-HAC-1177-2024-CONSOLIDATED",
      "sourceId": "SRC-0014",
      "title": "Order HAC/1177/2024 current consolidated XML",
      "authority": "BOE",
      "role": "binding",
      "url": "https://www.boe.es/datosabiertos/api/legislacion-consolidada/id/BOE-A-2024-22138",
      "path": "legal/order-hac-1177-2024-consolidated.xml",
      "kind": "xml",
      "accept": "application/xml",
      "maximumBytes": 250000,
      "bytes": 132877,
      "sha256": "bf3ed51c6cf3a3848ed163c0c0e7a59ff88c064ec7138609832a469a81c4a6ad",
      "sha512": "3e16886c8ba0d7c243515e16c35ef2c9c767c7519306401d5c20de506c09925e8c8a8c4160da8faae03ae9f7dff74d0499e5ddbecfe6f864ea99fdb6b8ae1eda",
      "lastModified": null,
      "licenseId": "BOE-REUSE-TERMS",
      "redistribution": "official-legal-text",
      "dependencies": ["BOE-ORDER-HAC-1177-2024"],
      "requiredFor": ["REG-0003", "REG-0005", "REG-0006", "REG-0007", "REG-0011"]
    },
    {
      "id": "BOE-RD-1619-2012-CONSOLIDATED",
      "sourceId": "SRC-0015",
      "title": "Royal Decree 1619/2012 current consolidated XML",
      "authority": "BOE",
      "role": "binding",
      "url": "https://www.boe.es/datosabiertos/api/legislacion-consolidada/id/BOE-A-2012-14696",
      "path": "legal/rd-1619-2012-consolidated.xml",
      "kind": "xml",
      "accept": "application/xml",
      "maximumBytes": 500000,
      "bytes": 285099,
      "sha256": "aa9420777a1ead608f86d3980e96e8f10da21021c19b91f4bd9c9b3133d562e1",
      "sha512": "ff11ca7fb8f83024a8b0b83bf1752334c1848ba5a41a7a33409a264c3a9795efbe585338f8d44277cc88bfe4a1491f47ee22b4b7633f8b90dc91f17ccae3bf44",
      "lastModified": null,
      "licenseId": "BOE-REUSE-TERMS",
      "redistribution": "official-legal-text",
      "dependencies": [],
      "requiredFor": ["REG-0001", "REG-0060", "REG-0061"]
    },
    {
      "id": "BOE-LOPDGDD-CONSOLIDATED",
      "sourceId": "SRC-0028",
      "title": "Organic Law 3/2018 current consolidated XML",
      "authority": "BOE",
      "role": "binding",
      "url": "https://www.boe.es/datosabiertos/api/legislacion-consolidada/id/BOE-A-2018-16673",
      "path": "legal/lopdgdd-consolidated.xml",
      "kind": "xml",
      "accept": "application/xml",
      "maximumBytes": 500000,
      "bytes": 410096,
      "sha256": "620a7bd1564910c3db09ecc1b2ee078ca7283aba366261c9741614de250e200d",
      "sha512": "458324f21f13cd2b850301f6df5b2b258cfbd0267eda9565ebc0e70365145f7adf06febc0b7b1f93b5a598cf125654a7337af32e73c9307e3db52d28a27961f8",
      "lastModified": null,
      "licenseId": "BOE-REUSE-TERMS",
      "redistribution": "official-legal-text",
      "dependencies": [],
      "requiredFor": ["PRIV-0001", "PRIV-0002", "PRIV-0003", "PRIV-0004"]
    },
    {
      "id": "AEAT-PORTAL",
      "sourceId": "SRC-0016",
      "title": "AEAT SIF and VERI*FACTU portal",
      "authority": "AEAT",
      "role": "interpretive",
      "url": "https://sede.agenciatributaria.gob.es/Sede/iva/sistemas-informaticos-facturacion-verifactu.html",
      "path": "technical/aeat-portal.html",
      "kind": "html",
      "accept": "text/html",
      "maximumBytes": 100000,
      "bytes": 27386,
      "sha256": "c4b621b1af643888b2c5196699b72d4db0f97b41580e6ecbc3db1f38d01d6844",
      "sha512": "44d23e41d9b6a6c035aa9ec5caf4066852b87ef02dcd46037ce413e9f123547729d33b14109d4489705ad7aff1c520920dbbf066c07835d3d40456415a605fac",
      "lastModified": "Tue, 21 Jul 2026 08:26:54 GMT",